
Title,Body,Vendor,Type,Price
Disconnect Tee,"Step through the chaos. Surreal forest portal graphic printed on our heavyweight tee.",Unplugged Supply,Shirt,45
Signal Fade Hoodie,"Cropped hoodie with retro green grid and subtle flying saucer motif. Stay unplugged.",Unplugged Supply,Hoodie,65
Wave Drop Hoodie,"Pullover hoodie featuring an ocean portal graphic for those ready to drift away.",Unplugged Supply,Hoodie,65
Drift Frequency Tee,"City meets shoreline. Glitchy skyline blending into waves on this comfortable tee.",Unplugged Supply,Shirt,45
Signature Denim,"Classic denim with a branded waistband label hidden inside. Minimalism on point.",Unplugged Supply,Jeans,80
